title,description,link,guid
"Soccer for tots (2-3 years)",http://www.brisbane.qld.gov.au/whats-on/events-listed-type/sports-recreation-programs/active-parks-events?trumbaEmbed=view%3devent%26eventid%3d123954551,,"Bookings essential. Get the children to develop their motor skills, balance, coordination while strengthening their relationship with their parents through fun games. They will learn a new skill every session. Parents are actively involved in this fun activity."
"Fitness for all","Ozcare, 48 Peel Street, South Brisbane <br/>Tuesday, August 1, 2017, 10&nbsp;&ndash;&nbsp;11am <br/><br/><img src=""http://www.trumba.com/i/DgBx6Bqd%2AaQdhVpbtaDGBfRE.jpg"" title=""Fitness for all"" alt=""Fitness for all"" width=""132"" height=""83"" /><br/><br/>A cardiovascular and strength based training program targeting the upper and lower body, focused on coordination and safe boxing techniques. This class can be adapted for all fitness levels. <br/><br/><b>Cost</b>:&nbsp;Free <br/><b>Event type</b>:&nbsp;Fitness &amp; well-being, Free <br/><b>Bookings</b>:&nbsp;Not required. For more information phone Edwardo at Inclusive Fitness Solutions on 0433 975 766. <br/><b>Meeting point</b>:&nbsp;Meet at reception <br/><br/>",http://www.brisbane.qld.gov.au/whats-on/events-listed-type/sports-recreation-programs/active-parks-events?trumbaEmbed=view%3devent%26eventid%3d123954556,
"Fitness for all",http://www.brisbane.qld.gov.au/whats-on/events-listed-type/sports-recreation-programs/active-parks-events?trumbaEmbed=view%3devent%26eventid%3d123954556,,"A cardiovascular and strength based training program targeting the upper and lower body, focused on coordination and safe boxing techniques. This class can be adapted for all fitness levels."
"Soccer for young children (4-5 years)","Tuesday, August 1, 2017, 10&nbsp;&ndash;&nbsp;10:30am <br/><br/><img src=""http://www.trumba.com/i/DgBxhVDbbK9n1dy0d3JYm9PA.jpg"" title=""Soccer for young children (4-5 years)"" alt=""Soccer for young children (4-5 years)"" width=""132"" height=""79"" /><br/><br/>Bookings essential. Introducing young children to the basic concepts of soccer. Along with ball skills, they will also learn how to kick the ball and play the &quot;big game&quot;. Each game will be 1v1 or 2v2 which gives the child a feel of what it&#39;s like to play a real soccer game. Parents are actively involved in this great activity. <br/><br/><b>Cost</b>:&nbsp;Free <br/><b>Event type</b>:&nbsp;Fitness &amp; well-being, Free <br/><b>Bookings</b>:&nbsp;Bookings essential. To book phone Mauricio at Grasshopper Soccer on 0430 588 067. <br/><b>Meeting point</b>:&nbsp;Playground <br/><b>Requirements</b>:&nbsp;Closed in shoes <br/><b>Age</b>:&nbsp;4-5 years <br/><b>Venue</b>:&nbsp;<a href=""javascript:Nav(&#39;objectid=221603&amp;objecttype=19243&amp;view=object&amp;-childview=&amp;-index=&#39;,&#39;detailBase&#39;)"">Dorrington Park, Ashgrove</a> <br/><b>Venue address</b>:&nbsp;<a href=""http://maps.google.com/?q=-27.440247,152.985687(Dorrington+Park%2c+Ashgrove)"" target=""_blank"">Dorrington Park, 5 Mirrabooka Road, Ashgrove</a> <br/><br/>",http://www.brisbane.qld.gov.au/whats-on/events-listed-type/sports-recreation-programs/active-parks-events?trumbaEmbed=view%3devent%26eventid%3d123954564,
"Soccer for young children (4-5 years)",http://www.brisbane.qld.gov.au/whats-on/events-listed-type/sports-recreation-programs/active-parks-events?trumbaEmbed=view%3devent%26eventid%3d123954564,,"Bookings essential. Introducing young children to the basic concepts of soccer. Along with ball skills, they will also learn how to kick the ball and play the ""big game"". Each game will be 1v1 or 2v2 which gives the child a feel of what it's like to play a real soccer game. Parents are actively involved in this great activity."
Yogalates,"Tuesday, August 1, 2017, 10&nbsp;&ndash;&nbsp;11am <br/><br/><img src=""http://www.trumba.com/i/DgBx0Bls8RMFMthNXg0HH8Jx.jpg"" title=""Yogalates"" alt=""Yogalates"" width=""132"" height=""79"" /><br/><br/>Yoga and pilates fusion, a fitness routine that combines pilates exercises with the postures and breathing techniques of yoga. Suitable for all ages, no previous yoga experience required. <br/><br/><b>Cost</b>:&nbsp;Free <br/><b>Event type</b>:&nbsp;Fitness &amp; well-being, Free <br/><b>Bookings</b>:&nbsp;Not required. For more information phone Tatiana on 0439 643 586. <br/><b>Meeting point</b>:&nbsp;Next to club house <br/><b>Requirements</b>:&nbsp;Yoga mat or towel <br/><b>Venue</b>:&nbsp;<a href=""javascript:Nav(&#39;objectid=221624&amp;objecttype=19243&amp;view=object&amp;-childview=&amp;-index=&#39;,&#39;detailBase&#39;)"">Jack Cook Memorial Park, Taringa</a> <br/><b>Venue address</b>:&nbsp;<a href=""http://maps.google.com/?q=-27.4936949,152.9920029(Jack+Cook+Memorial+Park%2c+Taringa)"" target=""_blank"">Jack Cook Memorial Park, 99 Gailey Road, Taringa</a> <br/><br/>",http://www.brisbane.qld.gov.au/whats-on/events-listed-type/sports-recreation-programs/active-parks-events?trumbaEmbed=view%3devent%26eventid%3d123954495,
Yogalates,http://www.brisbane.qld.gov.au/whats-on/events-listed-type/sports-recreation-programs/active-parks-events?trumbaEmbed=view%3devent%26eventid%3d123954495,,"Yoga and pilates fusion, a fitness routine that combines pilates exercises with the postures and breathing techniques of yoga. Suitable for all ages, no previous yoga experience required."
"Baby bootcamp","Tuesday, August 1, 2017, 10:30&nbsp;&ndash;&nbsp;11:30am <br/><br/><img src=""http://www.trumba.com/i/DgB%2Ae%2AwLOQztCXGiKcsMf0-z.jpg"" title=""Baby bootcamp"" alt=""Baby bootcamp"" width=""132"" height=""79"" /><br/><br/>Bookings essential. A post-natal group fitness session aiming to re-build strength, tone and overall cardio fitness following the birth of your baby. Great opportunity to meet other mums. <br/><br/><b>Cost</b>:&nbsp;Free <br/><b>Event type</b>:&nbsp;Fitness &amp; well-being, Free <br/><b>Bookings</b>:&nbsp;Bookings essential. To book phone Jill at FitLiving on 0431 778 513. <br/><b>Meeting point</b>:&nbsp;At the tennis wall near AFL carpark <br/><b>Requirements</b>:&nbsp;Baby in pram <br/><b>Venue</b>:&nbsp;<a href=""javascript:Nav(&#39;objectid=221621&amp;objecttype=19243&amp;view=object&amp;-childview=&amp;-index=&#39;,&#39;detailBase&#39;)"">Hawthorne Park, Hawthorne</a> <br/><b>Venue address</b>:&nbsp;<a href=""http://maps.google.com/?q=-27.46368217,153.0620424(Hawthorne+Park%2c+Hawthorne)"" target=""_blank"">Hawthorne Park, 140 Riding Road, Hawthorne</a> <br/><br/>",http://www.brisbane.qld.gov.au/whats-on/events-listed-type/sports-recreation-programs/active-parks-events?trumbaEmbed=view%3devent%26eventid%3d123976974,
"Baby bootcamp",http://www.brisbane.qld.gov.au/whats-on/events-listed-type/sports-recreation-programs/active-parks-events?trumbaEmbed=view%3devent%26eventid%3d123976974,,"Bookings essential. A post-natal group fitness session aiming to re-build strength, tone and overall cardio fitness following the birth of your baby. Great opportunity to meet other mums."
"Tai Chi Qigong","Tuesday, August 1, 2017, 12:30&nbsp;&ndash;&nbsp;1:30pm <br/><br/><img src=""http://www.trumba.com/i/DgC0kXwBxSbE11NrOrARyB-t.jpg"" title=""Tai Chi Qigong"" alt=""Tai Chi Qigong"" width=""132"" height=""79"" /><br/><br/>This dynamic activity is invigorating, works with both your body and your mind and will help you feel relaxed, refreshed and calm. Tai Chi is becoming recognised as the world&#39;s most beneficial healthy system. Rejuvenate your body and learn to create a tranquil mind. Join any week - all welcome. <br/><br/><b>Cost</b>:&nbsp;Free <br/><b>Event type</b>:&nbsp;Fitness &amp; well-being, Free <br/><b>Bookings</b>:&nbsp;Not required. For more information phone Australian Academy of Tai Chi and Qigong on 07 3358 1955 or visit <a href=""http://www.livingchi.com.au/"" target=""_blank"">www.livingchi.com.au</a> <br/><b>Meeting point</b>:&nbsp;Grass area above duck pond, next to waterfall, Alice St Brisbane <br/><b>Venue</b>:&nbsp;<a href=""javascript:Nav(&#39;objectid=200265&amp;objecttype=19243&amp;view=object&amp;-childview=&amp;-index=&#39;,&#39;detailBase&#39;)"">City Botanic Gardens, Brisbane City</a> <br/><b>Venue address</b>:&nbsp;<a href=""http://maps.google.com/?q=-27.473798,153.029947(City+Botanic+Gardens%2c+Brisbane+City)"" target=""_blank"">City Botanic Gardens, 147 Alice Street, Brisbane City</a> <br/><br/>",http://www.brisbane.qld.gov.au/whats-on/events-listed-type/sports-recreation-programs/active-parks-events?trumbaEmbed=view%3devent%26eventid%3d123976990,
"Tai Chi Qigong",http://www.brisbane.qld.gov.au/whats-on/events-listed-type/sports-recreation-programs/active-parks-events?trumbaEmbed=view%3devent%26eventid%3d123976990,,"This dynamic activity is invigorating, works with both your body and your mind and will help you feel relaxed, refreshed and calm. Tai Chi is becoming recognised as the world's most beneficial healthy system. Rejuvenate your body and learn to create a tranquil mind. Join any week - all welcome."
"Fitness for mums","Tuesday, August 1, 2017, 4:15&nbsp;&ndash;&nbsp;5:15pm <br/><br/><img src=""http://www.trumba.com/i/DgA3dq-6ZJ7CcAztY3JzswOW.jpg"" title=""Fitness for mums"" alt=""Fitness for mums"" width=""132"" height=""79"" /><br/><br/>Bookings essential. Stay fit and healthy after having your baby. Re-build strength, tone and achieve overall cardio fitness. This is a great opportunity to meet other mums. <br/><br/><b>Cost</b>:&nbsp;Free <br/><b>Event type</b>:&nbsp;Fitness &amp; well-being, Free <br/><b>Bookings</b>:&nbsp;Bookings essential. To book phone Nadia from Nadu Fitness on 0487 070 174. <br/><b>Meeting point</b>:&nbsp;Near the playground <br/><b>Venue</b>:&nbsp;<a href=""javascript:Nav(&#39;objectid=289601&amp;objecttype=19243&amp;view=object&amp;-childview=&amp;-index=&#39;,&#39;detailBase&#39;)"">Grenier Park, Acacia Ridge</a> <br/><b>Venue address</b>:&nbsp;<a href=""http://maps.google.com/?q=-27.579044,153.019307(Grenier+Park%2c+Acacia+Ridge)"" target=""_blank"">Grenier Park, 20 Oxley Street, Acacia Ridge</a> <br/><br/>",http://www.brisbane.qld.gov.au/whats-on/events-listed-type/sports-recreation-programs/active-parks-events?trumbaEmbed=view%3devent%26eventid%3d123977023,
"Fitness for mums",http://www.brisbane.qld.gov.au/whats-on/events-listed-type/sports-recreation-programs/active-parks-events?trumbaEmbed=view%3devent%26eventid%3d123977023,,"Bookings essential. Stay fit and healthy after having your baby. Re-build strength, tone and achieve overall cardio fitness. This is a great opportunity to meet other mums."
"Latin TLC training","Tuesday, August 1, 2017, 5:15&nbsp;&ndash;&nbsp;6:15pm <br/><br/><img src=""http://www.trumba.com/i/DgCUd5vIaM6YL9jpvUqnqkdM.jpg"" title=""Latin TLC training"" alt=""Latin TLC training"" width=""132"" height=""79"" /><br/><br/>Bookings essential. A fitness workout that will challenge you to the max. The program is divided in two sessions one strength based the other cardio based and combined with Latin music provides an excellent pleasurable workout. <br/><br/><b>Cost</b>:&nbsp;Free <br/><b>Event type</b>:&nbsp;Fitness &amp; well-being, Free <br/><b>Bookings</b>:&nbsp;Bookings essential. To book phone Edwardo at Inclusive Fitness Solutions on 0433 975 766. <br/><b>Meeting point</b>:&nbsp;By the picnic tables, corner of Montague Rd and Hill End Tce <br/><b>Venue</b>:&nbsp;<a href=""javascript:Nav(&#39;objectid=221660&amp;objecttype=19243&amp;view=object&amp;-childview=&amp;-index=&#39;,&#39;detailBase&#39;)"">Orleigh Park, West End</a> <br/><b>Venue address</b>:&nbsp;<a href=""http://maps.google.com/?q=-27.486727,152.997003(Orleigh+Park%2c+West+End)"" target=""_blank"">Orleigh Park, 68 Hill End Terrace, West End</a> <br/><b>Boat ramp facilities</b>:&nbsp;Single pontoon <br/><b>Boat ramp information</b>:&nbsp;Orleigh Park Pontoon,  Status: closed <br/><br/>",http://www.brisbane.qld.gov.au/whats-on/events-listed-type/sports-recreation-programs/active-parks-events?trumbaEmbed=view%3devent%26eventid%3d123977042,
"Latin TLC training",http://www.brisbane.qld.gov.au/whats-on/events-listed-type/sports-recreation-programs/active-parks-events?trumbaEmbed=view%3devent%26eventid%3d123977042,,"Bookings essential. A fitness workout that will challenge you to the max. The program is divided in two sessions one strength based the other cardio based and combined with Latin music provides an excellent pleasurable workout."
Pilates,"Tuesday, August 1, 2017, 5:15&nbsp;&ndash;&nbsp;6:15pm <br/><br/><img src=""http://www.trumba.com/i/DgBn-7sg-wtZpLktWji-fURD.jpg"" title=""Pilates"" alt=""Pilates"" width=""132"" height=""79"" /><br/><br/>A beginner to immediate workout combining elements of pilates strengthening, stretching and exercises specially designed to improve posture, reduce stress and tone your body. This workout is suitable for adults of all ages and options will be provided for all levels. <br/><br/><b>Cost</b>:&nbsp;Free <br/><b>Event type</b>:&nbsp;Fitness &amp; well-being, Free <br/><b>Bookings</b>:&nbsp;Not required. For more information phone Sandra on 0422 526 924. <br/><b>Meeting point</b>:&nbsp;Near the gym equipment area, off Riding Road <br/><b>Requirements</b>:&nbsp;Yoga mat or towel <br/><b>Venue</b>:&nbsp;<a href=""javascript:Nav(&#39;objectid=221621&amp;objecttype=19243&amp;view=object&amp;-childview=&amp;-index=&#39;,&#39;detailBase&#39;)"">Hawthorne Park, Hawthorne</a> <br/><b>Venue address</b>:&nbsp;<a href=""http://maps.google.com/?q=-27.46368217,153.0620424(Hawthorne+Park%2c+Hawthorne)"" target=""_blank"">Hawthorne Park, 140 Riding Road, Hawthorne</a> <br/><br/>",http://www.brisbane.qld.gov.au/whats-on/events-listed-type/sports-recreation-programs/active-parks-events?trumbaEmbed=view%3devent%26eventid%3d123977064,
Pilates,http://www.brisbane.qld.gov.au/whats-on/events-listed-type/sports-recreation-programs/active-parks-events?trumbaEmbed=view%3devent%26eventid%3d123977064,,"A beginner to immediate workout combining elements of pilates strengthening, stretching and exercises specially designed to improve posture, reduce stress and tone your body. This workout is suitable for adults of all ages and options will be provided for all levels."
"Hip Hop dance","Tuesday, August 1, 2017, 5:30&nbsp;&ndash;&nbsp;6:30pm <br/><br/><img src=""http://www.trumba.com/i/DgBkIPBwOuuVDKxA1TGFP5JI.jpg"" title=""Hip Hop dance"" alt=""Hip Hop dance"" width=""132"" height=""79"" /><br/><br/>Come dance to the greatest current and old school Hip Hop, Rap and RnB tracks. Whatever is getting you moving in the clubs, this is what will get you moving in this class! Come refine your skills and chase that feeling of mastering a routine. This is a style anyone can learn, no prior training is necessary. <br/><br/><b>Cost</b>:&nbsp;Free <br/><b>Event type</b>:&nbsp;Fitness &amp; well-being, Free <br/><b>Bookings</b>:&nbsp;Not required. For more information phone Janna from Mad Dance House on 3210 6724. <br/><b>Meeting point</b>:&nbsp;South Bank Piazza <br/><b>Venue</b>:&nbsp;<a href=""javascript:Nav(&#39;objectid=464155&amp;objecttype=19243&amp;view=object&amp;-childview=&amp;-index=&#39;,&#39;detailBase&#39;)"">South Bank Parklands</a> <br/><b>Venue address</b>:&nbsp;<a href=""http://maps.google.com/?q=-27.478191,153.022929(South+Bank+Parklands)"" target=""_blank"">South Bank Parklands, Corner Ernest Street, Stanley Street and Grey Street, South Brisbane</a> <br/><br/>",http://www.brisbane.qld.gov.au/whats-on/events-listed-type/sports-recreation-programs/active-parks-events?trumbaEmbed=view%3devent%26eventid%3d123978561,
"Hip Hop dance",http://www.brisbane.qld.gov.au/whats-on/events-listed-type/sports-recreation-programs/active-parks-events?trumbaEmbed=view%3devent%26eventid%3d123978561,,"Come dance to the greatest current and old school Hip Hop, Rap and RnB tracks. Whatever is getting you moving in the clubs, this is what will get you moving in this class! Come refine your skills and chase that feeling of mastering a routine. This is a style anyone can learn, no prior training is necessary."
"Tai Chi Qigong","Wednesday, August 2, 2017, 7&nbsp;&ndash;&nbsp;8am <br/><br/><img src=""http://www.trumba.com/i/DgDKVDumlpuK%2AUx81tRBo3Re.jpg"" title=""Tai Chi Qigong"" alt=""Tai Chi Qigong"" width=""132"" height=""79"" /><br/><br/>This dynamic activity is invigorating, works with both your body and your mind and will help you feel relaxed, refreshed and calm. Tai Chi is becoming recognised as the world&#39;s most beneficial healthy system. Rejuvenate your body and learn to create a tranquil mind. Join any week - all welcome. <br/><br/><b>Cost</b>:&nbsp;Free <br/><b>Event type</b>:&nbsp;Fitness &amp; well-being, Free <br/><b>Bookings</b>:&nbsp;Not required. For more information phone Australian Academy of Tai Chi and Qigong on 07 3358 1955 or visit <a href=""http://www.livingchi.com.au/"" target=""_blank"">www.livingchi.com.au</a> <br/><b>Meeting point</b>:&nbsp;Near playground, off Burilda St, Hendra <br/><b>Venue</b>:&nbsp;<a href=""javascript:Nav(&#39;objectid=472399&amp;objecttype=19243&amp;view=object&amp;-childview=&amp;-index=&#39;,&#39;detailBase&#39;)"">The Beirne Park, Hendra</a> <br/><b>Venue address</b>:&nbsp;<a href=""http://maps.google.com/?q=-27.418901,153.06855(The+Beirne+Park%2c+Hendra)"" target=""_blank"">The Beirne Park, 77 Gerler Road, Hendra</a> <br/><br/>",http://www.brisbane.qld.gov.au/whats-on/events-listed-type/sports-recreation-programs/active-parks-events?trumbaEmbed=view%3devent%26eventid%3d123977079,
"Tai Chi Qigong",http://www.brisbane.qld.gov.au/whats-on/events-listed-type/sports-recreation-programs/active-parks-events?trumbaEmbed=view%3devent%26eventid%3d123977079,,"This dynamic activity is invigorating, works with both your body and your mind and will help you feel relaxed, refreshed and calm. Tai Chi is becoming recognised as the world's most beneficial healthy system. Rejuvenate your body and learn to create a tranquil mind. Join any week - all welcome."
"Tai Chi Qigong","Wednesday, August 2, 2017, 8:30&nbsp;&ndash;&nbsp;9:30am <br/><br/><img src=""http://www.trumba.com/i/DgAXhN2o9HUwh9nGnr57608y.jpg"" title=""Tai Chi Qigong"" alt=""Tai Chi Qigong"" width=""132"" height=""79"" /><br/><br/>This dynamic activity is invigorating, works with both your body and your mind and will help you feel relaxed, refreshed and calm. Tai Chi is becoming recognised as the world&#39;s most beneficial healthy system. Rejuvenate your body and learn to create a tranquil mind. Join any week - all welcome. <br/><br/><b>Cost</b>:&nbsp;Free <br/><b>Event type</b>:&nbsp;Fitness &amp; well-being, Free <br/><b>Bookings</b>:&nbsp;Not required. For more information phone Australian Academy of Tai Chi and Qigong on 07 3358 1955 or visit <a href=""http://www.livingchi.com.au/"" target=""_blank"">www.livingchi.com.au</a> <br/><b>Meeting point</b>:&nbsp;Opposite Florence Street, near car park, Wynnum Esp., Wynnum <br/><b>Venue</b>:&nbsp;<a href=""javascript:Nav(&#39;objectid=221691&amp;objecttype=19243&amp;view=object&amp;-childview=&amp;-index=&#39;,&#39;detailBase&#39;)"">Wynnum Wading Pool Park, Wynnum</a> <br/><b>Venue address</b>:&nbsp;<a href=""http://maps.google.com/?q=-27.441406,153.176161(Wynnum+Wading+Pool+Park%2c+Wynnum)"" target=""_blank"">Wynnum Wading Pool Park, 173 Wynnum Esplanade, Wynnum</a> <br/><br/>",http://www.brisbane.qld.gov.au/whats-on/events-listed-type/sports-recreation-programs/active-parks-events?trumbaEmbed=view%3devent%26eventid%3d123977090,
"Tai Chi Qigong",http://www.brisbane.qld.gov.au/whats-on/events-listed-type/sports-recreation-programs/active-parks-events?trumbaEmbed=view%3devent%26eventid%3d123977090,,"This dynamic activity is invigorating, works with both your body and your mind and will help you feel relaxed, refreshed and calm. Tai Chi is becoming recognised as the world's most beneficial healthy system. Rejuvenate your body and learn to create a tranquil mind. Join any week - all welcome."
"Tai Chi Qigong","Wednesday, August 2, 2017, 9&nbsp;&ndash;&nbsp;10am <br/><br/><img src=""http://www.trumba.com/i/DgBtxkqFoKDPcPYvoBD5lL8j.jpg"" title=""Tai Chi Qigong"" alt=""Tai Chi Qigong"" width=""132"" height=""79"" /><br/><br/>This dynamic activity is invigorating, works with both your body and your mind and will help you feel relaxed, refreshed and calm. Tai Chi is becoming recognised as the world&#39;s most beneficial healthy system. Rejuvenate your body and learn to create a tranquil mind. Join any week - all welcome. <br/><br/><b>Cost</b>:&nbsp;$5 <br/><b>Event type</b>:&nbsp;Fitness &amp; well-being <br/><b>Bookings</b>:&nbsp;Not required. For more information phone Australian Academy of Tai Chi and Qigong on 07 3358 1955 or visit <a href=""http://www.livingchi.com.au/"" target=""_blank"">www.livingchi.com.au</a> <br/><b>Meeting point</b>:&nbsp;Near shelter shed <br/><b>Venue</b>:&nbsp;<a href=""javascript:Nav(&#39;objectid=221569&amp;objecttype=19243&amp;view=object&amp;-childview=&amp;-index=&#39;,&#39;detailBase&#39;)"">Anstead Bushland Reserve, Anstead</a> <br/><b>Venue address</b>:&nbsp;<a href=""http://maps.google.com/?q=-27.546442,152.857289(Anstead+Bushland+Reserve%2c+Anstead)"" target=""_blank"">Anstead Bushland Reserve, 552 Hawksbury Road, Anstead</a> <br/><br/>",http://www.brisbane.qld.gov.au/whats-on/events-listed-type/sports-recreation-programs/active-parks-events?trumbaEmbed=view%3devent%26eventid%3d123977109,
"Tai Chi Qigong",http://www.brisbane.qld.gov.au/whats-on/events-listed-type/sports-recreation-programs/active-parks-events?trumbaEmbed=view%3devent%26eventid%3d123977109,,"This dynamic activity is invigorating, works with both your body and your mind and will help you feel relaxed, refreshed and calm. Tai Chi is becoming recognised as the world's most beneficial healthy system. Rejuvenate your body and learn to create a tranquil mind. Join any week - all welcome."
"Circuits and intervals","Wednesday, August 2, 2017, 9:15&nbsp;&ndash;&nbsp;10:15am <br/><br/><img src=""http://www.trumba.com/i/DgAcO0Y-FrxWWsTG8Miinfog.jpg"" title=""Circuits and intervals"" alt=""Circuits and intervals"" width=""132"" height=""79"" /><br/><br/>Bookings essential. Body conditioning circuits and interval training proven to be the most time efficient and effective way to increase and maintain your fitness levels. Varied programs designed to target strength, build muscular endurance and improve cardiovascular performance. <br/><br/><b>Cost</b>:&nbsp;Free <br/><b>Event type</b>:&nbsp;Fitness &amp; well-being, Free <br/><b>Bookings</b>:&nbsp;Bookings essential. To book phone Christine from Fitness with a Twist on 0406 425 561. <br/><b>Meeting point</b>:&nbsp;Near half basketball court <br/><b>Venue</b>:&nbsp;<a href=""javascript:Nav(&#39;objectid=221578&amp;objecttype=19243&amp;view=object&amp;-childview=&amp;-index=&#39;,&#39;detailBase&#39;)"">Bowman Park, Bardon</a> <br/><b>Venue address</b>:&nbsp;<a href=""http://maps.google.com/?q=-27.4583172,152.9749773(Bowman+Park%2c+Bardon)"" target=""_blank"">Bowman Park, 247 Simpsons Road, Bardon</a> <br/><br/>",http://www.brisbane.qld.gov.au/whats-on/events-listed-type/sports-recreation-programs/active-parks-events?trumbaEmbed=view%3devent%26eventid%3d123977133,
"Circuits and intervals",http://www.brisbane.qld.gov.au/whats-on/events-listed-type/sports-recreation-programs/active-parks-events?trumbaEmbed=view%3devent%26eventid%3d123977133,,"Bookings essential. Body conditioning circuits and interval training proven to be the most time efficient and effective way to increase and maintain your fitness levels. Varied programs designed to target strength, build muscular endurance and improve cardiovascular performance."
"Fit mums boxing","Wednesday, August 2, 2017, 9:15&nbsp;&ndash;&nbsp;10:15am <br/><br/><img src=""http://www.trumba.com/i/DgBdu60N4D3DLE4bBwkram5j.jpg"" title=""Fit mums boxing"" alt=""Fit mums boxing"" width=""132"" height=""79"" /><br/><br/>A higher intensity exercise class in the park that includes interval training and boxing activities. Mums, dads and bubs welcome. Bring a towel and no bookings essential. <br/><br/><b>Cost</b>:&nbsp;Free <br/><b>Event type</b>:&nbsp;Fitness &amp; well-being, Free <br/><b>Bookings</b>:&nbsp;Not required. For more information phone Belinda at Mums-ercise on 0424 505 343. <br/><b>Meeting point</b>:&nbsp;On the grass near the kids playground <br/><b>Requirements</b>:&nbsp;Yoga mat or towel <br/><b>Venue</b>:&nbsp;<a href=""javascript:Nav(&#39;objectid=221667&amp;objecttype=19243&amp;view=object&amp;-childview=&amp;-index=&#39;,&#39;detailBase&#39;)"">Raymond Park, Kangaroo Point</a> <br/><b>Venue address</b>:&nbsp;<a href=""http://maps.google.com/?q=-27.480864,153.0369638(Raymond+Park%2c+Kangaroo+Point)"" target=""_blank"">Raymond Park, 184 Wellington Road, Kangaroo Point</a> <br/><br/>",http://www.brisbane.qld.gov.au/whats-on/events-listed-type/sports-recreation-programs/active-parks-events?trumbaEmbed=view%3devent%26eventid%3d123977357,
"Fit mums boxing",http://www.brisbane.qld.gov.au/whats-on/events-listed-type/sports-recreation-programs/active-parks-events?trumbaEmbed=view%3devent%26eventid%3d123977357,,"A higher intensity exercise class in the park that includes interval training and boxing activities. Mums, dads and bubs welcome. Bring a towel and no bookings essential."
