title,description,link,guid
"Boxing and fitness circuit","Wednesday, August 2, 2017, 9:30&nbsp;&ndash;&nbsp;10:30am <br/><br/><img src=""http://www.trumba.com/i/DgBxTWH8KnDODIWJOG%2AE0tCw.jpg"" title=""Boxing and fitness circuit"" alt=""Boxing and fitness circuit"" width=""132"" height=""79"" /><br/><br/>Bookings essential. Fitness circuit using the park gym equipment with a boxing warm-up. All levels catered for. <br/><br/><b>Cost</b>:&nbsp;Free <br/><b>Event type</b>:&nbsp;Fitness &amp; well-being, Free <br/><b>Bookings</b>:&nbsp;Bookings essential. To book phone Jen&#39;s Outdoor Gym on 0410 010 316. <br/><b>Meeting point</b>:&nbsp;Near gym equipment area. <br/><b>Requirements</b>:&nbsp;Boxing glove liners. <br/><b>Age</b>:&nbsp;16 years and over <br/><b>Venue</b>:&nbsp;<a href=""javascript:Nav(&#39;objectid=288686&amp;objecttype=19243&amp;view=object&amp;-childview=&amp;-index=&#39;,&#39;detailBase&#39;)"">Akuna Street Park, Kenmore</a> <br/><b>Venue address</b>:&nbsp;<a href=""http://maps.google.com/?q=-27.512338,152.950867(Akuna+Street+Park%2c+Kenmore)"" target=""_blank"">Akuna Street Park, 114 Akuna Street, Kenmore</a> <br/><br/>",http://www.brisbane.qld.gov.au/whats-on/events-listed-type/sports-recreation-programs/active-parks-events?trumbaEmbed=view%3devent%26eventid%3d123977382,
"Boxing and fitness circuit",http://www.brisbane.qld.gov.au/whats-on/events-listed-type/sports-recreation-programs/active-parks-events?trumbaEmbed=view%3devent%26eventid%3d123977382,,"Bookings essential. Fitness circuit using the park gym equipment with a boxing warm-up. All levels catered for."
"Fitness 4 me","Wednesday, August 2, 2017, 9:30&nbsp;&ndash;&nbsp;10:30am <br/><br/><img src=""http://www.trumba.com/i/DgDjtVXUll6A1ejfCbrre2Xs.jpg"" title=""Fitness 4 me"" alt=""Fitness 4 me"" width=""132"" height=""79"" /><br/><br/>An outdoor exercise class that includes skipping and hula hooping to assist in improving cardio, strength and core stability. Mums, dads and bubs welcome. <br/><br/><b>Cost</b>:&nbsp;Free <br/><b>Event type</b>:&nbsp;Fitness &amp; well-being, Free <br/><b>Bookings</b>:&nbsp;Not required. For more information phone Aggie from Mona Health Coach on 0433 463 578. <br/><b>Meeting point</b>:&nbsp;Under cover pavilion area to the right of the park entrance. <br/><b>Venue</b>:&nbsp;<a href=""javascript:Nav(&#39;objectid=221671&amp;objecttype=19243&amp;view=object&amp;-childview=&amp;-index=&#39;,&#39;detailBase&#39;)"">Rocks Riverside Park, Seventeen Mile Rocks</a> <br/><b>Venue address</b>:&nbsp;<a href=""http://maps.google.com/?q=-27.542285,152.960407(Rocks+Riverside+Park%2c+Seventeen+Mile+Rocks)"" target=""_blank"">Rocks Riverside Park, 531 Seventeen Mile Rocks Road, Seventeen Mile Rocks</a> <br/><br/>",http://www.brisbane.qld.gov.au/whats-on/events-listed-type/sports-recreation-programs/active-parks-events?trumbaEmbed=view%3devent%26eventid%3d123977401,
"Fitness 4 me",http://www.brisbane.qld.gov.au/whats-on/events-listed-type/sports-recreation-programs/active-parks-events?trumbaEmbed=view%3devent%26eventid%3d123977401,,"An outdoor exercise class that includes skipping and hula hooping to assist in improving cardio, strength and core stability. Mums, dads and bubs welcome."
"Mums boxing and fitness","Wednesday, August 2, 2017, 9:30&nbsp;&ndash;&nbsp;10:30am <br/><br/><img src=""http://www.trumba.com/i/DgCJYV6%2AxQ1K5hf0ozVoN1Wm.jpg"" title=""Mums boxing and fitness"" alt=""Mums boxing and fitness"" width=""132"" height=""79"" /><br/><br/>Bookings essential. Increase your fitness using general boxing techniques, combinations and punches incorporating legs, arms, abs and running into the workout. A great way to get active, increase your cardio fitness and build all-over strength. Bubs are welcome at the class. <br/><br/><b>Cost</b>:&nbsp;Free <br/><b>Event type</b>:&nbsp;Fitness &amp; well-being, Free <br/><b>Bookings</b>:&nbsp;Bookings essential. To book phone Suanne at Fitness Forever on 0414 437 616. <br/><b>Meeting point</b>:&nbsp;Meet at reception. <br/><b>Venue</b>:&nbsp;<a href=""javascript:Nav(&#39;objectid=290384&amp;objecttype=19243&amp;view=object&amp;-childview=&amp;-index=&#39;,&#39;detailBase&#39;)"">Karawatha Forest Park and Discovery Centre</a> <br/><b>Venue address</b>:&nbsp;<a href=""http://maps.google.com/?q=-27.623277,153.094261(Karawatha+Forest+Park+and+Discovery+Centre)"" target=""_blank"">Karawatha Forest Park and Discovery Centre, 149 Acacia Road, Karawatha</a> <br/><br/>",http://www.brisbane.qld.gov.au/whats-on/events-listed-type/sports-recreation-programs/active-parks-events?trumbaEmbed=view%3devent%26eventid%3d123977423,
"Mums boxing and fitness",http://www.brisbane.qld.gov.au/whats-on/events-listed-type/sports-recreation-programs/active-parks-events?trumbaEmbed=view%3devent%26eventid%3d123977423,,"Bookings essential. Increase your fitness using general boxing techniques, combinations and punches incorporating legs, arms, abs and running into the workout. A great way to get active, increase your cardio fitness and build all-over strength. Bubs are welcome at the class."
Pilates,"Wednesday, August 2, 2017, 9:30&nbsp;&ndash;&nbsp;10:30am <br/><br/><img src=""http://www.trumba.com/i/DgDE8WxaO4FAJOiksznXb1aI.jpg"" title=""Pilates"" alt=""Pilates"" width=""132"" height=""79"" /><br/><br/>Pilates simultaneously strengthens and stretches muscles of the spine, pelvis and abdominals through mat based exercises. <br/><br/><b>Cost</b>:&nbsp;Free <br/><b>Event type</b>:&nbsp;Fitness &amp; well-being, Free <br/><b>Bookings</b>:&nbsp;Not required. For more information phone Sharon at Precision Pilates on 0439 996 049. <br/><b>Meeting point</b>:&nbsp;Near the playground <br/><b>Requirements</b>:&nbsp;Yoga mat or towel <br/><b>Venue</b>:&nbsp;<a href=""javascript:Nav(&#39;objectid=221603&amp;objecttype=19243&amp;view=object&amp;-childview=&amp;-index=&#39;,&#39;detailBase&#39;)"">Dorrington Park, Ashgrove</a> <br/><b>Venue address</b>:&nbsp;<a href=""http://maps.google.com/?q=-27.440247,152.985687(Dorrington+Park%2c+Ashgrove)"" target=""_blank"">Dorrington Park, 5 Mirrabooka Road, Ashgrove</a> <br/><br/>",http://www.brisbane.qld.gov.au/whats-on/events-listed-type/sports-recreation-programs/active-parks-events?trumbaEmbed=view%3devent%26eventid%3d123977449,
Pilates,http://www.brisbane.qld.gov.au/whats-on/events-listed-type/sports-recreation-programs/active-parks-events?trumbaEmbed=view%3devent%26eventid%3d123977449,,"Pilates simultaneously strengthens and stretches muscles of the spine, pelvis and abdominals through mat based exercises."
"Stretch, tone, bend and balance","Wednesday, August 2, 2017, 9:30&nbsp;&ndash;&nbsp;10:30am <br/><br/><img src=""http://www.trumba.com/i/DgAKnVtxDwFXIeZqMK6EfZcs.jpg"" title=""Stretch, tone, bend and balance"" alt=""Stretch, tone, bend and balance"" width=""132"" height=""79"" /><br/><br/>Tone the body, increase flexibility, gain strength and relax the mind with yoga for mums with children and open to anyone else that wishes to join in. If you have children they can play or join in while you get to move your body. Focus is on flexibility, core strength, pelvic floor and abdominals, all in the beautiful outdoors. <br/><br/><b>Cost</b>:&nbsp;Free <br/><b>Event type</b>:&nbsp;Fitness &amp; well-being <br/><b>Bookings</b>:&nbsp;Not required. For more information phone Haydie at Inspirit Health and Yoga on 0415 834 659. <br/><b>Meeting point</b>:&nbsp;By the playground <br/><b>Requirements</b>:&nbsp;Yoga mat or towel <br/><b>Venue</b>:&nbsp;<a href=""javascript:Nav(&#39;objectid=221576&amp;objecttype=19243&amp;view=object&amp;-childview=&amp;-index=&#39;,&#39;detailBase&#39;)"">Booker Place Park, Bellbowrie</a> <br/><b>Venue address</b>:&nbsp;<a href=""http://maps.google.com/?q=-27.563935,152.891911(Booker+Place+Park%2c+Bellbowrie)"" target=""_blank"">Booker Place Park, 89 Birkin Road, Bellbowrie</a> <br/><br/>",http://www.brisbane.qld.gov.au/whats-on/events-listed-type/sports-recreation-programs/active-parks-events?trumbaEmbed=view%3devent%26eventid%3d124001912,
"Stretch, tone, bend and balance",http://www.brisbane.qld.gov.au/whats-on/events-listed-type/sports-recreation-programs/active-parks-events?trumbaEmbed=view%3devent%26eventid%3d124001912,,"Tone the body, increase flexibility, gain strength and relax the mind with yoga for mums with children and open to anyone else that wishes to join in. If you have children they can play or join in while you get to move your body. Focus is on flexibility, core strength, pelvic floor and abdominals, all in the beautiful outdoors."
Yoga,"Wednesday, August 2, 2017, 10:30&nbsp;&ndash;&nbsp;11:30am <br/><br/><img src=""http://www.trumba.com/i/DgDINew7rl-DZx-0g66rZZWU.jpg"" title=""Yoga"" alt=""Yoga"" width=""132"" height=""79"" /><br/><br/>Yoga calms the mind and body while stretching and strengthening through long hold poses. All levels catered for. <br/><br/><b>Cost</b>:&nbsp;Free <br/><b>Event type</b>:&nbsp;Fitness &amp; well-being, Free <br/><b>Bookings</b>:&nbsp;Not required. For more information phone Irene on 0433 346 819. <br/><b>Meeting point</b>:&nbsp;Near the playground <br/><b>Requirements</b>:&nbsp;Yoga mat or towel <br/><b>Venue</b>:&nbsp;<a href=""javascript:Nav(&#39;objectid=221662&amp;objecttype=19243&amp;view=object&amp;-childview=&amp;-index=&#39;,&#39;detailBase&#39;)"">Perth Street Park, Camp Hill</a> <br/><b>Venue address</b>:&nbsp;<a href=""http://maps.google.com/?q=-27.48651,153.073893(Perth+Street+Park%2c+Camp+Hill)"" target=""_blank"">Perth Street Park, 74 Perth Street, Camp Hill</a> <br/><br/>",http://www.brisbane.qld.gov.au/whats-on/events-listed-type/sports-recreation-programs/active-parks-events?trumbaEmbed=view%3devent%26eventid%3d123977467,
Yoga,http://www.brisbane.qld.gov.au/whats-on/events-listed-type/sports-recreation-programs/active-parks-events?trumbaEmbed=view%3devent%26eventid%3d123977467,,"Yoga calms the mind and body while stretching and strengthening through long hold poses. All levels catered for."
"Skateboarding masterclass","Wednesday, August 2, 2017, 3:30&nbsp;&ndash;&nbsp;4:30pm <br/><br/><img src=""http://www.trumba.com/i/DgCifmqOOnHgjP7wlz0sc5wV.jpg"" title=""Skateboarding masterclass"" alt=""Skateboarding masterclass"" width=""132"" height=""79"" /><br/><br/>Bookings essential. These workshops make learning to skateboard fun, safe and easy for everyone. Through weekly coaching sessions you will learn the skills of skateboarding in an exciting, social and safe environment. The program also provides a great opportunity for parents to interact with their kids through the activities. All ages and levels welcome. <br/><br/><b>Cost</b>:&nbsp;Free <br/><b>Event type</b>:&nbsp;Fitness &amp; well-being, Free <br/><b>Bookings</b>:&nbsp;Bookings essential. To book visit <a href=""http://australianskateboarding.com/events/tags/brisbane-city-council/"" target=""_blank"">Australian Skateboard Community Initiative</a>&#160;or phone 1300 918 531. <br/><b>Meeting point</b>:&nbsp;Skatepark <br/><b>Requirements</b>:&nbsp;Skateboard and helmet if you have one.  Some equipment will be provided. <br/><b>Venue</b>:&nbsp;<a href=""javascript:Nav(&#39;objectid=221650&amp;objecttype=19243&amp;view=object&amp;-childview=&amp;-index=&#39;,&#39;detailBase&#39;)"">Neal Macrossan Playground Park, Paddington</a> <br/><b>Venue address</b>:&nbsp;<a href=""http://maps.google.com/?q=-27.462786,153.010822(Neal+Macrossan+Playground+Park%2c+Paddington)"" target=""_blank"">Neal Macrossan Playground Park, 14 Caroline Street, Paddington</a> <br/><br/>",http://www.brisbane.qld.gov.au/whats-on/events-listed-type/sports-recreation-programs/active-parks-events?trumbaEmbed=view%3devent%26eventid%3d123977526,
"Skateboarding masterclass",http://www.brisbane.qld.gov.au/whats-on/events-listed-type/sports-recreation-programs/active-parks-events?trumbaEmbed=view%3devent%26eventid%3d123977526,,"Bookings essential. These workshops make learning to skateboard fun, safe and easy for everyone. Through weekly coaching sessions you will learn the skills of skateboarding in an exciting, social and safe environment. The program also provides a great opportunity for parents to interact with their kids through the activities. All ages and levels welcome."
"ACT-ivate Children's Club (Junior 3-4 years)","Wednesday, August 2, 2017, 3:45&nbsp;&ndash;&nbsp;4:45pm <br/><br/><img src=""http://www.trumba.com/i/DgCilUM4etYahXD8yx5XRFGU.jpg"" title=""ACT-ivate Children&#39;s Club (Junior 3-4 years)"" alt=""ACT-ivate Children&#39;s Club (Junior 3-4 years)"" width=""132"" height=""79"" /><br/><br/>Bookings essential. Using balls, hoops, parachutes, tunnels, jumping sacks, puppets, storybooks, costumes and music, participants will explore all the different ways their growing bodies can move. These sessions will ACT-ivate the children and their caregivers and have a focus on creativity and fun in a safe, relaxed and energetic environment.<br /> <br /> Amarina Park is next to Ashgrove Library.&#160; <br/><br/><b>Cost</b>:&nbsp;Free <br/><b>Event type</b>:&nbsp;Fitness &amp; well-being <br/><b>Bookings</b>:&nbsp;Bookings essential. To book visit <a href=""http://www.bazilgrumble.com/hidden-pages/event-registration/"" target=""_blank"">Bazil Grumble</a>&#160;or for more information phone 0411 246 487. <br/><b>Meeting point</b>:&nbsp;Park outside library <br/><b>Requirements</b>:&nbsp;Sun protection, fully enclosed shoes, insect repellent and drinking water. <br/><b>Age</b>:&nbsp;3-4 years <br/><b>Venue</b>:&nbsp;<a href=""javascript:Nav(&#39;objectid=453092&amp;objecttype=19243&amp;view=object&amp;-childview=&amp;-index=&#39;,&#39;detailBase&#39;)"">Amarina Avenue Park, Ashgrove</a> <br/><b>Venue address</b>:&nbsp;<a href=""http://maps.google.com/?q=-27.4435481,152.9873221(Amarina+Avenue+Park%2c+Ashgrove)"" target=""_blank"">Amarina Avenue Park, 87 Amarina Avenue, Ashgrove</a> <br/><br/>",http://www.brisbane.qld.gov.au/whats-on/events-listed-type/sports-recreation-programs/active-parks-events?trumbaEmbed=view%3devent%26eventid%3d123978339,
"ACT-ivate Children's Club (Junior 3-4 years)",http://www.brisbane.qld.gov.au/whats-on/events-listed-type/sports-recreation-programs/active-parks-events?trumbaEmbed=view%3devent%26eventid%3d123978339,,"Bookings essential. Using balls, hoops, parachutes, tunnels, jumping sacks, puppets, storybooks, costumes and music, participants will explore all the different ways their growing bodies can move. These sessions will ACT-ivate the children and their caregivers and have a focus on creativity and fun in a safe, relaxed and energetic environment.
 
 Amarina Park is next to Ashgrove Library.&nbsp;"
"ACT-ivate Children's Club (Senior 5-10 years)","Wednesday, August 2, 2017, 3:45&nbsp;&ndash;&nbsp;4:45pm <br/><br/><img src=""http://www.trumba.com/i/DgDsyJD3XrFyqA0CNfw5mFzC.jpg"" title=""ACT-ivate Children&#39;s Club (Senior 5-10 years)"" alt=""ACT-ivate Children&#39;s Club (Senior 5-10 years)"" width=""132"" height=""79"" /><br/><br/>Bookings essential. Come and play ball games, brave the obstacle courses and relays, enjoy sack and egg and spoon races, participate in drama based interactive games and much more! These sessions will ACTivate participants and have a strong focus on creativity and fun in a safe, relaxed and energetic environment.<br /> <br /> Amarina Park is next to Ashgrove Library. <br/><br/><b>Cost</b>:&nbsp;Free <br/><b>Event type</b>:&nbsp;Fitness &amp; well-being, Free <br/><b>Bookings</b>:&nbsp;Bookings essential. To book visit <a href=""http://www.bazilgrumble.com/hidden-pages/event-registration/"" target=""_blank"">Bazil Grumble</a>&#160;or for more information phone 0411 246 487. <br/><b>Meeting point</b>:&nbsp;Park outside library <br/><b>Requirements</b>:&nbsp;Sun protection, fully enclosed shoes, insect repellent and drinking water. <br/><b>Age</b>:&nbsp;5-10 years <br/><b>Venue</b>:&nbsp;<a href=""javascript:Nav(&#39;objectid=453092&amp;objecttype=19243&amp;view=object&amp;-childview=&amp;-index=&#39;,&#39;detailBase&#39;)"">Amarina Avenue Park, Ashgrove</a> <br/><b>Venue address</b>:&nbsp;<a href=""http://maps.google.com/?q=-27.4435481,152.9873221(Amarina+Avenue+Park%2c+Ashgrove)"" target=""_blank"">Amarina Avenue Park, 87 Amarina Avenue, Ashgrove</a> <br/><br/>",http://www.brisbane.qld.gov.au/whats-on/events-listed-type/sports-recreation-programs/active-parks-events?trumbaEmbed=view%3devent%26eventid%3d123978356,
"ACT-ivate Children's Club (Senior 5-10 years)",http://www.brisbane.qld.gov.au/whats-on/events-listed-type/sports-recreation-programs/active-parks-events?trumbaEmbed=view%3devent%26eventid%3d123978356,,"Bookings essential. Come and play ball games, brave the obstacle courses and relays, enjoy sack and egg and spoon races, participate in drama based interactive games and much more! These sessions will ACTivate participants and have a strong focus on creativity and fun in a safe, relaxed and energetic environment.
 
 Amarina Park is next to Ashgrove Library."
"Family fitness challenge","Wednesday, August 2, 2017, 4&nbsp;&ndash;&nbsp;5pm <br/><br/><img src=""http://www.trumba.com/i/DgBEcje7feB-zdzltdwNcqaJ.jpg"" title=""Family fitness challenge"" alt=""Family fitness challenge"" width=""132"" height=""116"" /><br/><br/>Get the family off the screens and get active together! Find out what steps the whole family can take with eating and exercise to live a happier healthier life together. <br/><br/><b>Cost</b>:&nbsp;Free <br/><b>Event type</b>:&nbsp;Fitness &amp; well-being <br/><b>Bookings</b>:&nbsp;Bookings not required. For more information phone Katie from Love of Life Fitness on 0422 138 271. <br/><b>Meeting point</b>:&nbsp;At the basketball court. <br/><b>Venue</b>:&nbsp;<a href=""javascript:Nav(&#39;objectid=259985&amp;objecttype=19243&amp;view=object&amp;-childview=&amp;-index=&#39;,&#39;detailBase&#39;)"">Wakerley Park, Wakerley</a> <br/><b>Venue address</b>:&nbsp;<a href=""http://maps.google.com/?q=-27.486054,153.151319(Wakerley+Park%2c+Wakerley)"" target=""_blank"">Wakerley Park, 74  Dianthus St, Wakerley</a> <br/><br/>",http://www.brisbane.qld.gov.au/whats-on/events-listed-type/sports-recreation-programs/active-parks-events?trumbaEmbed=view%3devent%26eventid%3d123978371,
"Family fitness challenge",http://www.brisbane.qld.gov.au/whats-on/events-listed-type/sports-recreation-programs/active-parks-events?trumbaEmbed=view%3devent%26eventid%3d123978371,,"Get the family off the screens and get active together! Find out what steps the whole family can take with eating and exercise to live a happier healthier life together."
"Outdoor group training","Wednesday, August 2, 2017, 4:45&nbsp;&ndash;&nbsp;5:45pm <br/><br/><img src=""http://www.trumba.com/i/DgCF5JIXRgPTX2Fm2lNREg6R.jpg"" title=""Outdoor group training"" alt=""Outdoor group training"" width=""132"" height=""83"" /><br/><br/>Live longer healthier lifestyles with cutting edge training techniques. Get the most out of a basic but effective education on nutrition. <br/><br/><b>Cost</b>:&nbsp;Free <br/><b>Event type</b>:&nbsp;Fitness &amp; well-being, Free <br/><b>Bookings</b>:&nbsp;Not required. For more information phone Frank from Power Burn Fitness on 0434 346 054. <br/><b>Meeting point</b>:&nbsp;Near the BBQ table by the tennis court <br/><b>Venue</b>:&nbsp;<a href=""javascript:Nav(&#39;objectid=221677&amp;objecttype=19243&amp;view=object&amp;-childview=&amp;-index=&#39;,&#39;detailBase&#39;)"">Svoboda Park, Kuraby</a> <br/><b>Venue address</b>:&nbsp;<a href=""http://maps.google.com/?q=-27.6055096542,153.098034939(Svoboda+Park%2c+Kuraby)"" target=""_blank"">Svoboda Park, 1490 Beenleigh Rd, Kuraby</a> <br/><br/>",http://www.brisbane.qld.gov.au/whats-on/events-listed-type/sports-recreation-programs/active-parks-events?trumbaEmbed=view%3devent%26eventid%3d123977537,
"Outdoor group training",http://www.brisbane.qld.gov.au/whats-on/events-listed-type/sports-recreation-programs/active-parks-events?trumbaEmbed=view%3devent%26eventid%3d123977537,,"Live longer healthier lifestyles with cutting edge training techniques. Get the most out of a basic but effective education on nutrition."
Boxfit,"Wednesday, August 2, 2017, 5:30&nbsp;&ndash;&nbsp;6:30pm <br/><br/><img src=""http://www.trumba.com/i/DgByVGKypzeoHU2z-fOSg70I.jpg"" title=""Boxfit"" alt=""Boxfit"" width=""132"" height=""79"" /><br/><br/>Bookings essential. A cardiovascular and strength based training program targeting the upper and lower body, focussed on coordination and safe boxing techniques. This class can be adapted for all fitness levels. <br/><br/><b>Cost</b>:&nbsp;Free <br/><b>Event type</b>:&nbsp;Fitness &amp; well-being, Free <br/><b>Bookings</b>:&nbsp;Bookings essential. To book phone Edwardo at Inclusive Fitness Solutions on 0433 975 766. <br/><b>Meeting point</b>:&nbsp;Mosaic square picnic area <br/><b>Venue</b>:&nbsp;<a href=""javascript:Nav(&#39;objectid=222090&amp;objecttype=19243&amp;view=object&amp;-childview=&amp;-index=&#39;,&#39;detailBase&#39;)"">Kangaroo Point Cliffs Park, Kangaroo Point</a> <br/><b>Venue address</b>:&nbsp;<a href=""http://maps.google.com/?q=-27.4762464,153.0344868(Kangaroo+Point+Cliffs+Park%2c+Kangaroo+Point)"" target=""_blank"">Kangaroo Point Cliffs Park, 29 River Terrace, Kangaroo Point</a> <br/><b>Boat ramp facilities</b>:&nbsp;Single boat ramp, Single pontoon <br/><b>Boat ramp information</b>:&nbsp;Kangaroo Point Boat Ramp,  Status: open,  Naval Stores Pontoon,  Status: open <br/><br/>",http://www.brisbane.qld.gov.au/whats-on/events-listed-type/sports-recreation-programs/active-parks-events?trumbaEmbed=view%3devent%26eventid%3d123977549,
Boxfit,http://www.brisbane.qld.gov.au/whats-on/events-listed-type/sports-recreation-programs/active-parks-events?trumbaEmbed=view%3devent%26eventid%3d123977549,,"Bookings essential. A cardiovascular and strength based training program targeting the upper and lower body, focussed on coordination and safe boxing techniques. This class can be adapted for all fitness levels."
"Jive and Swing","Wednesday, August 2, 2017, 5:30&nbsp;&ndash;&nbsp;6:30pm <br/><br/><img src=""http://www.trumba.com/i/DgAdF1OzZLwLZqsAl4A6Ertg.jpg"" title=""Jive and Swing"" alt=""Jive and Swing"" width=""132"" height=""79"" /><br/><br/>The 20&#39;s, 30&#39;s and 40&#39;s brought about some exciting and intriguing dance styles. If you are looking for something new to change up your weekdays why not join in this class and learn a variety of swing styles and routines that are fun and energetic. <br/><br/><b>Cost</b>:&nbsp;Free <br/><b>Event type</b>:&nbsp;Fitness &amp; well-being, Free <br/><b>Bookings</b>:&nbsp;Not required. For more information phone Rebecca from Orchards Dance Studio on 0422 967 267. <br/><b>Meeting point</b>:&nbsp;South Bank Piazza <br/><b>Venue</b>:&nbsp;<a href=""javascript:Nav(&#39;objectid=464155&amp;objecttype=19243&amp;view=object&amp;-childview=&amp;-index=&#39;,&#39;detailBase&#39;)"">South Bank Parklands</a> <br/><b>Venue address</b>:&nbsp;<a href=""http://maps.google.com/?q=-27.478191,153.022929(South+Bank+Parklands)"" target=""_blank"">South Bank Parklands, Corner Ernest Street, Stanley Street and Grey Street, South Brisbane</a> <br/><br/>",http://www.brisbane.qld.gov.au/whats-on/events-listed-type/sports-recreation-programs/active-parks-events?trumbaEmbed=view%3devent%26eventid%3d123978568,
"Jive and Swing",http://www.brisbane.qld.gov.au/whats-on/events-listed-type/sports-recreation-programs/active-parks-events?trumbaEmbed=view%3devent%26eventid%3d123978568,,"The 20's, 30's and 40's brought about some exciting and intriguing dance styles. If you are looking for something new to change up your weekdays why not join in this class and learn a variety of swing styles and routines that are fun and energetic."
"Boxing and fitness circuit","Thursday, August 3, 2017, 6&nbsp;&ndash;&nbsp;7am <br/><br/><img src=""http://www.trumba.com/i/DgDKrwJa36MPsBqwWsVr76LQ.jpg"" title=""Boxing and fitness circuit"" alt=""Boxing and fitness circuit"" width=""132"" height=""79"" /><br/><br/>Bookings essential. Bootcamp type exercises including boxing warm up followed by body weight exercises and aerobic movement. This is a fast way to fitness and weight loss. <br/><br/><b>Cost</b>:&nbsp;Free <br/><b>Event type</b>:&nbsp;Fitness &amp; well-being, Free <br/><b>Bookings</b>:&nbsp;Bookings essential. To book phone Jen&#39;s Outdoor Gym on 0410 010 316. <br/><b>Meeting point</b>:&nbsp;Near playground <br/><b>Requirements</b>:&nbsp;Boxing glove liners <br/><b>Age</b>:&nbsp;16 years and over <br/><b>Venue</b>:&nbsp;<a href=""javascript:Nav(&#39;objectid=221661&amp;objecttype=19243&amp;view=object&amp;-childview=&amp;-index=&#39;,&#39;detailBase&#39;)"">Perrin Park, Toowong</a> <br/><b>Venue address</b>:&nbsp;<a href=""http://maps.google.com/?q=-27.491695,152.991428(Perrin+Park%2c+Toowong)"" target=""_blank"">Perrin Park, 99 Gailey Road, Toowong</a> <br/><br/>",http://www.brisbane.qld.gov.au/whats-on/events-listed-type/sports-recreation-programs/active-parks-events?trumbaEmbed=view%3devent%26eventid%3d123977662,
"Boxing and fitness circuit",http://www.brisbane.qld.gov.au/whats-on/events-listed-type/sports-recreation-programs/active-parks-events?trumbaEmbed=view%3devent%26eventid%3d123977662,,"Bookings essential. Bootcamp type exercises including boxing warm up followed by body weight exercises and aerobic movement. This is a fast way to fitness and weight loss."
