title,description,link,guid
"Flexibility and core conditioning","Sunday, July 30, 2017, 7:30&nbsp;&ndash;&nbsp;8:30am <br/><br/><img src=""http://www.trumba.com/i/DgAhwUGd48JuyzsAe20BOVig.jpg"" title=""Flexibility and core conditioning"" alt=""Flexibility and core conditioning"" width=""132"" height=""79"" /><br/><br/>Bookings essential. Increase the flexibility throughout your entire body with our class focused on static stretches and abdominal exercises designed to strengthen and lengthen muscles, improve posture, increase overall stability of your body and aid in the prevention of injury. <br/><br/><b>Cost</b>:&nbsp;Free <br/><b>Event type</b>:&nbsp;Fitness &amp; well-being <br/><b>Bookings</b>:&nbsp;Bookings essential. To book phone Suanne at Fitness Forever on 0414 437 616. <br/><b>Meeting point</b>:&nbsp;Park bench near the dragon playground <br/><b>Requirements</b>:&nbsp;Yoga mat or towel <br/><b>Venue</b>:&nbsp;<a href=""javascript:Nav(&#39;objectid=221639&amp;objecttype=19243&amp;view=object&amp;-childview=&amp;-index=&#39;,&#39;detailBase&#39;)"">Majestic Park, Coorparoo</a> <br/><b>Venue address</b>:&nbsp;<a href=""http://maps.google.com/?q=-27.508477,153.06726(Majestic+Park%2c+Coorparoo)"" target=""_blank"">Majestic Park, 62 Park Street, Coorparoo</a> <br/><br/>",http://www.brisbane.qld.gov.au/whats-on/events-listed-type/sports-recreation-programs/active-parks-events?trumbaEmbed=view%3devent%26eventid%3d123978182,
"Flexibility and core conditioning",http://www.brisbane.qld.gov.au/whats-on/events-listed-type/sports-recreation-programs/active-parks-events?trumbaEmbed=view%3devent%26eventid%3d123978182,,"Bookings essential. Increase the flexibility throughout your entire body with our class focused on static stretches and abdominal exercises designed to strengthen and lengthen muscles, improve posture, increase overall stability of your body and aid in the prevention of injury."
"Wetlands social ride and bike maintenance","Sunday, July 30, 2017, 7:30&nbsp;&ndash;&nbsp;9:30am <br/><br/><img src=""http://www.trumba.com/i/DgAHYRxt0CN72I2PoCfA-gD2.jpg"" title=""Wetlands social ride and bike maintenance"" alt=""Wetlands social ride and bike maintenance"" width=""132"" height=""79"" /><br/><br/>Bookings essential. Don&#39;t get caught out, learn how to change a tyre and&#160;keep your bike rolling with basic maintenance tips. Then come along on a social ride to explore the beautiful Boondall Wetlands Reserve along the 13km return journey of the Boondall bikeway to Nudgee Beach, including a stop at Anne Beasley lookout and then return.<br /> <br /> Presented as part of Council&#8217;s Active and Healthy &amp; Cycling Brisbane programs. <br/><br/><b>Cost</b>:&nbsp;Free <br/><b>Event type</b>:&nbsp;Fitness &amp; well-being, Free <br/><b>Bookings</b>:&nbsp;Bookings essential. To book visit&#160;<a href=""https://www.eventbrite.com.au/e/bike-maintenance-and-boondall-tour-tickets-35128553449"" target=""_blank"">Eventbrite</a>&#160;or for more information phone Cycle Away on 0427 431 481. <br/><b>Meeting point</b>:&nbsp;Environmental Centre picnic area. <br/><b>Requirements</b>:&nbsp;Bike, helmet, insect repellent and sunscreen. <br/><b>Venue</b>:&nbsp;<a href=""javascript:Nav(&#39;objectid=221577&amp;objecttype=19243&amp;view=object&amp;-childview=&amp;-index=&#39;,&#39;detailBase&#39;)"">Boondall Wetlands Environment Centre</a> <br/><b>Venue address</b>:&nbsp;<a href=""http://maps.google.com/?q=-27.340807,153.0764163(Boondall+Wetlands+Environment+Centre)"" target=""_blank"">Boondall Wetlands Environment Centre, 31 Paperbark Drive (entry via Stanworth Rd), Boondall</a> <br/><br/>",http://www.brisbane.qld.gov.au/whats-on/events-listed-type/sports-recreation-programs/active-parks-events?trumbaEmbed=view%3devent%26eventid%3d123978585,
"Wetlands social ride and bike maintenance",http://www.brisbane.qld.gov.au/whats-on/events-listed-type/sports-recreation-programs/active-parks-events?trumbaEmbed=view%3devent%26eventid%3d123978585,,"Bookings essential. Don't get caught out, learn how to change a tyre and&nbsp;keep your bike rolling with basic maintenance tips. Then come along on a social ride to explore the beautiful Boondall Wetlands Reserve along the 13km return journey of the Boondall bikeway to Nudgee Beach, including a stop at Anne Beasley lookout and then return.
 
 Presented as part of Council’s Active and Healthy &amp; Cycling Brisbane programs."
Yoga,"Sunday, July 30, 2017, 7:30&nbsp;&ndash;&nbsp;8:30am <br/><br/><img src=""http://www.trumba.com/i/DgDUD-DeCfFsj7viSqa6f83A.jpg"" title=""Yoga"" alt=""Yoga"" width=""132"" height=""79"" /><br/><br/>Come enjoy a sweet-tempered free yoga session by the beautiful Manly foreshore before enjoying the delights of the markets and cafe . All levels welcome! <br/><br/><b>Cost</b>:&nbsp;Free <br/><b>Event type</b>:&nbsp;Fitness &amp; well-being, Free <br/><b>Bookings</b>:&nbsp;Not required. For more information phone John on 0403 676 435. <br/><b>Meeting point</b>:&nbsp;At the end of Stewart Parade, near the Sea Scouts <br/><b>Requirements</b>:&nbsp;Yoga mat or towel <br/><b>Venue</b>:&nbsp;<a href=""javascript:Nav(&#39;objectid=274793&amp;objecttype=19243&amp;view=object&amp;-childview=&amp;-index=&#39;,&#39;detailBase&#39;)"">Darling Point Park (road reserve)</a> <br/><b>Venue address</b>:&nbsp;<a href=""http://maps.google.com/?q=-27.447102,153.187002(Darling+Point+Park+road+reserve)"" target=""_blank"">Darling Point Park (road reserve), 95 Lower Esplanade, Manly</a> <br/><br/>",http://www.brisbane.qld.gov.au/whats-on/events-listed-type/sports-recreation-programs/active-parks-events?trumbaEmbed=view%3devent%26eventid%3d123953807,
Yoga,http://www.brisbane.qld.gov.au/whats-on/events-listed-type/sports-recreation-programs/active-parks-events?trumbaEmbed=view%3devent%26eventid%3d123953807,,"Come enjoy a sweet-tempered free yoga session by the beautiful Manly foreshore before enjoying the delights of the markets and cafe . All levels welcome!"
"Tai Chi Qigong","Sunday, July 30, 2017, 8&nbsp;&ndash;&nbsp;9am <br/><br/><img src=""http://www.trumba.com/i/DgALKdFlZbzAswCk-GYWOHsb.jpg"" title=""Tai Chi Qigong"" alt=""Tai Chi Qigong"" width=""132"" height=""79"" /><br/><br/>This dynamic activity is invigorating, works with both your body and your mind and will help you feel relaxed, refreshed and calm. Tai Chi is becoming recognised as the world&#39;s most beneficial healthy system. Rejuvenate your body and learn to create a tranquil mind. Join any week - all welcome. <br/><br/><b>Cost</b>:&nbsp;Free <br/><b>Event type</b>:&nbsp;Fitness &amp; well-being, Free <br/><b>Bookings</b>:&nbsp;Not required. For more information visit&#160;<a href=""http://www.livingchi.com.au"" target=""_blank"">Australian Academy of Tai Chi</a> or phone 07 3358 1955. <br/><b>Meeting point</b>:&nbsp;Near playground on Sydney Street, Fairfield. <br/><b>Venue</b>:&nbsp;<a href=""javascript:Nav(&#39;objectid=221670&amp;objecttype=19243&amp;view=object&amp;-childview=&amp;-index=&#39;,&#39;detailBase&#39;)"">Robinson Park, Fairfield</a> <br/><b>Venue address</b>:&nbsp;<a href=""http://maps.google.com/?q=-27.508533,153.023566(Robinson+Park%2c+Fairfield)"" target=""_blank"">Robinson Park, 65 Ashby Street, Fairfield</a> <br/><br/>",http://www.brisbane.qld.gov.au/whats-on/events-listed-type/sports-recreation-programs/active-parks-events?trumbaEmbed=view%3devent%26eventid%3d123978246,
"Tai Chi Qigong",http://www.brisbane.qld.gov.au/whats-on/events-listed-type/sports-recreation-programs/active-parks-events?trumbaEmbed=view%3devent%26eventid%3d123978246,,"This dynamic activity is invigorating, works with both your body and your mind and will help you feel relaxed, refreshed and calm. Tai Chi is becoming recognised as the world's most beneficial healthy system. Rejuvenate your body and learn to create a tranquil mind. Join any week - all welcome."
"Tai Chi Qigong","Sunday, July 30, 2017, 8&nbsp;&ndash;&nbsp;9am <br/><br/><img src=""http://www.trumba.com/i/DgAgbjXb368qyzSFwoeDO1iM.jpg"" title=""Tai Chi Qigong"" alt=""Tai Chi Qigong"" width=""132"" height=""79"" /><br/><br/>This dynamic activity is invigorating, works with both your body and your mind and will help you feel relaxed, refreshed and calm. Tai Chi is becoming recognised as the world&#39;s most beneficial healthy system. Rejuvenate your body and learn to create a tranquil mind. Join any week - all welcome. <br/><br/><b>Cost</b>:&nbsp;$5 <br/><b>Event type</b>:&nbsp;Fitness &amp; well-being <br/><b>Bookings</b>:&nbsp;Not required. For more information visit&#160;<a href=""http://www.livingchi.com.au"" target=""_blank"">Australian Academy of Tai Chi</a> or phone 07 3358 1955. <br/><b>Meeting point</b>:&nbsp;Near the playground. <br/><b>Venue</b>:&nbsp;<a href=""javascript:Nav(&#39;objectid=221690&amp;objecttype=19243&amp;view=object&amp;-childview=&amp;-index=&#39;,&#39;detailBase&#39;)"">Woolcock Park, Red Hill</a> <br/><b>Venue address</b>:&nbsp;<a href=""http://maps.google.com/?q=-27.447563,153.000869(Woolcock+Park%2c+Red+Hill)"" target=""_blank"">Woolcock Park, 92 Waterworks Road, Red Hill</a> <br/><br/>",http://www.brisbane.qld.gov.au/whats-on/events-listed-type/sports-recreation-programs/active-parks-events?trumbaEmbed=view%3devent%26eventid%3d123978257,
"Tai Chi Qigong",http://www.brisbane.qld.gov.au/whats-on/events-listed-type/sports-recreation-programs/active-parks-events?trumbaEmbed=view%3devent%26eventid%3d123978257,,"This dynamic activity is invigorating, works with both your body and your mind and will help you feel relaxed, refreshed and calm. Tai Chi is becoming recognised as the world's most beneficial healthy system. Rejuvenate your body and learn to create a tranquil mind. Join any week - all welcome."
Zumba®,"Sunday, July 30, 2017, 8:30&nbsp;&ndash;&nbsp;9:30am <br/><br/><img src=""http://www.trumba.com/i/DgAsSYik2LD8BBvCTI1qBQf8.jpg"" title=""Zumba®"" alt=""Zumba®"" width=""132"" height=""79"" /><br/><br/>With an infectious blend of Latin and International rhythms and easy to follow moves Zumba&#174; boasts a global following of millions. Why? It&#8217;s fun, it&#8217;s easy, it&#8217;s different, it&#8217;s effective. <br/><br/><b>Cost</b>:&nbsp;Free <br/><b>Event type</b>:&nbsp;Fitness &amp; well-being, Free <br/><b>Bookings</b>:&nbsp;Not required. For more information phone BFit4Life - Dance, Cheer &amp; Fitness on 0415 651 290. <br/><b>Meeting point</b>:&nbsp;Basketball court <br/><b>Venue</b>:&nbsp;<a href=""javascript:Nav(&#39;objectid=288809&amp;objecttype=19243&amp;view=object&amp;-childview=&amp;-index=&#39;,&#39;detailBase&#39;)"">Calamvale District Park, Calamvale</a> <br/><b>Venue address</b>:&nbsp;<a href=""http://maps.google.com/?q=-27.62119061,153.0391036(Calamvale+District+Park%2c+Calamvale)"" target=""_blank"">Calamvale District Park, 31 Formby Street, Calamvale</a> <br/><br/>",http://www.brisbane.qld.gov.au/whats-on/events-listed-type/sports-recreation-programs/active-parks-events?trumbaEmbed=view%3devent%26eventid%3d123978280,
Zumba®,http://www.brisbane.qld.gov.au/whats-on/events-listed-type/sports-recreation-programs/active-parks-events?trumbaEmbed=view%3devent%26eventid%3d123978280,,"With an infectious blend of Latin and International rhythms and easy to follow moves Zumba® boasts a global following of millions. Why? It’s fun, it’s easy, it’s different, it’s effective."
"Foodies aboard - morning ride to Eat Street Markets","Sunday, July 30, 2017, 10:30am&nbsp;&ndash;&nbsp;1:30pm <br/><br/><img src=""http://www.trumba.com/i/DgAGk-JoNbEYe1v-PouFE8tR.jpg"" title=""Foodies aboard - morning ride to Eat Street Markets"" alt=""Foodies aboard - morning ride to Eat Street Markets"" width=""132"" height=""79"" /><br/><br/>A relaxing social ride to Eat Street Markets. Starting at New Farm Park, we ride by the river through Teneriffe and&#160;continue to Newstead House, then out to Eat Street Markets, Hamilton. We stop at the markets to eat and enjoy the festivities, then head back to New Farm Park.<br /> <br /> Presented as part of Council&#8217;s Active and Healthy &amp; Cycling Brisbane programs. <br/><br/><b>Cost</b>:&nbsp;Free <br/><b>Event type</b>:&nbsp;Fitness &amp; well-being, Free <br/><b>Bookings</b>:&nbsp;Not required. Just be at the meeting point 15 minutes before the ride starts. Bikes and equipment can be hired for $15 per person per activity but this must be arranged in advance. For more information contact Ross at Brisbane By Bicycle on 0413 253 366. <br/><b>Meeting point</b>:&nbsp;At the rotunda. <br/><b>Requirements</b>:&nbsp;Bike, helmet, water bottle, money for a coffee <br/><b>Venue</b>:&nbsp;<a href=""javascript:Nav(&#39;objectid=221651&amp;objecttype=19243&amp;view=object&amp;-childview=&amp;-index=&#39;,&#39;detailBase&#39;)"">New Farm Park, New Farm</a> <br/><b>Venue address</b>:&nbsp;<a href=""http://maps.google.com/?q=-27.469046,153.050932(New+Farm+Park%2c+New+Farm)"" target=""_blank"">New Farm Park, 137 Sydney Street, New Farm</a> <br/><br/>",http://www.brisbane.qld.gov.au/whats-on/events-listed-type/sports-recreation-programs/active-parks-events?trumbaEmbed=view%3devent%26eventid%3d123793136,
"Foodies aboard - morning ride to Eat Street Markets",http://www.brisbane.qld.gov.au/whats-on/events-listed-type/sports-recreation-programs/active-parks-events?trumbaEmbed=view%3devent%26eventid%3d123793136,,"A relaxing social ride to Eat Street Markets. Starting at New Farm Park, we ride by the river through Teneriffe and&nbsp;continue to Newstead House, then out to Eat Street Markets, Hamilton. We stop at the markets to eat and enjoy the festivities, then head back to New Farm Park.
 
 Presented as part of Council’s Active and Healthy &amp; Cycling Brisbane programs."
"10 of the best","Monday, July 31, 2017, 6&nbsp;&ndash;&nbsp;7am <br/><br/><img src=""http://www.trumba.com/i/DgC2oJ7pXvOu7nUilfCGeb9l.jpg"" title=""10 of the best"" alt=""10 of the best"" width=""132"" height=""79"" /><br/><br/>Bookings essential. This program combines both strength and cardio exercises providing participants with a highly challenging activity. &#160;This program targets the upper and lower body, concentrating in developing strength and cardiovascular fitness. The exercises are modified to cater for participant&#39;s different fitness levels. <br/><br/><b>Cost</b>:&nbsp;Free <br/><b>Event type</b>:&nbsp;Fitness &amp; well-being, Free <br/><b>Bookings</b>:&nbsp;Bookings essential. To book phone Edwardo at Inclusive Fitness Solutions on 0433 975 766. <br/><b>Meeting point</b>:&nbsp;By the playground, off Sylvan Road <br/><b>Venue</b>:&nbsp;<a href=""javascript:Nav(&#39;objectid=221684&amp;objecttype=19243&amp;view=object&amp;-childview=&amp;-index=&#39;,&#39;detailBase&#39;)"">Toowong Memorial Park, Toowong</a> <br/><b>Venue address</b>:&nbsp;<a href=""http://maps.google.com/?q=-27.479876,152.994272(Toowong+Memorial+Park%2c+Toowong)"" target=""_blank"">Toowong Memorial Park, 65 Sylvan Road, Toowong</a> <br/><br/>",http://www.brisbane.qld.gov.au/whats-on/events-listed-type/sports-recreation-programs/active-parks-events?trumbaEmbed=view%3devent%26eventid%3d123953847,
"10 of the best",http://www.brisbane.qld.gov.au/whats-on/events-listed-type/sports-recreation-programs/active-parks-events?trumbaEmbed=view%3devent%26eventid%3d123953847,,"Bookings essential. This program combines both strength and cardio exercises providing participants with a highly challenging activity. &nbsp;This program targets the upper and lower body, concentrating in developing strength and cardiovascular fitness. The exercises are modified to cater for participant's different fitness levels."
"Fitness challenge","Monday, July 31, 2017, 6&nbsp;&ndash;&nbsp;7am <br/><br/><img src=""http://www.trumba.com/i/DgAcO0Y-FrxWWsTG8Miinfog.jpg"" title=""Fitness challenge"" alt=""Fitness challenge"" width=""132"" height=""79"" /><br/><br/>Bookings essential. Bootcamp type exercises with an emphasis on cardio fitness and overall body and core strength. &#160;This will include a fitness test at the start, midway and then the finish to monitor your progress. &#160;All fitness levels welcome. <br/><br/><b>Cost</b>:&nbsp;Free <br/><b>Event type</b>:&nbsp;Fitness &amp; well-being, Free <br/><b>Bookings</b>:&nbsp;Bookings essential. To book phone Jen&#39;s Outdoor Gym on 0410 010 316. <br/><b>Meeting point</b>:&nbsp;By the picnic shelter, near the car park. <br/><b>Age</b>:&nbsp;16 years and over <br/><b>Venue</b>:&nbsp;<a href=""javascript:Nav(&#39;objectid=632785&amp;objecttype=19243&amp;view=object&amp;-childview=&amp;-index=&#39;,&#39;detailBase&#39;)"">Frew Park, Milton</a> <br/><b>Venue address</b>:&nbsp;<a href=""http://maps.google.com/?q=-27.4687,152.999598(Frew+Park%2c+Milton)"" target=""_blank"">Frew Park, 315 Milton Road, Milton</a> <br/><br/>",http://www.brisbane.qld.gov.au/whats-on/events-listed-type/sports-recreation-programs/active-parks-events?trumbaEmbed=view%3devent%26eventid%3d123953920,
"Fitness challenge",http://www.brisbane.qld.gov.au/whats-on/events-listed-type/sports-recreation-programs/active-parks-events?trumbaEmbed=view%3devent%26eventid%3d123953920,,"Bookings essential. Bootcamp type exercises with an emphasis on cardio fitness and overall body and core strength. &nbsp;This will include a fitness test at the start, midway and then the finish to monitor your progress. &nbsp;All fitness levels welcome."
"Fitness challenge","Monday, July 31, 2017, 7&nbsp;&ndash;&nbsp;8am <br/><br/><img src=""http://www.trumba.com/i/DgBdu60N4D3DLE4bBwkram5j.jpg"" title=""Fitness challenge"" alt=""Fitness challenge"" width=""132"" height=""79"" /><br/><br/>Lose weight, get fit, tone up for a healthier and fitter you. <br/><br/><b>Cost</b>:&nbsp;Free <br/><b>Event type</b>:&nbsp;Fitness &amp; well-being, Free <br/><b>Bookings</b>:&nbsp;Not required. For more information phone Fitness 4 U on 0412 552 885. <br/><b>Meeting point</b>:&nbsp;Albert Street gates <br/><b>Venue</b>:&nbsp;<a href=""javascript:Nav(&#39;objectid=200265&amp;objecttype=19243&amp;view=object&amp;-childview=&amp;-index=&#39;,&#39;detailBase&#39;)"">City Botanic Gardens, Brisbane City</a> <br/><b>Venue address</b>:&nbsp;<a href=""http://maps.google.com/?q=-27.473798,153.029947(City+Botanic+Gardens%2c+Brisbane+City)"" target=""_blank"">City Botanic Gardens, 147 Alice Street, Brisbane City</a> <br/><br/>",http://www.brisbane.qld.gov.au/whats-on/events-listed-type/sports-recreation-programs/active-parks-events?trumbaEmbed=view%3devent%26eventid%3d123953930,
"Fitness challenge",http://www.brisbane.qld.gov.au/whats-on/events-listed-type/sports-recreation-programs/active-parks-events?trumbaEmbed=view%3devent%26eventid%3d123953930,,"Lose weight, get fit, tone up for a healthier and fitter you."
"Tai Chi Qigong","Monday, July 31, 2017, 7:30&nbsp;&ndash;&nbsp;8:30am <br/><br/><img src=""http://www.trumba.com/i/DgBtxkqFoKDPcPYvoBD5lL8j.jpg"" title=""Tai Chi Qigong"" alt=""Tai Chi Qigong"" width=""132"" height=""79"" /><br/><br/>This dynamic activity is invigorating, works with both your body and your mind and will help you feel relaxed, refreshed and calm. Tai Chi is becoming recognised as the world&#39;s most beneficial healthy system. Rejuvenate your body and learn to create a tranquil mind. Join any week - all welcome. <br/><br/><b>Cost</b>:&nbsp;Free <br/><b>Event type</b>:&nbsp;Fitness &amp; well-being, Free <br/><b>Bookings</b>:&nbsp;Not required. For more information phone Australian Academy of Tai Chi and Qigong on 07 3358 1955 or visit <a href=""http://www.livingchi.com.au/"" target=""_blank"">www.livingchi.com.au</a> <br/><b>Meeting point</b>:&nbsp;Near the playground <br/><b>Venue</b>:&nbsp;<a href=""javascript:Nav(&#39;objectid=626898&amp;objecttype=19243&amp;view=object&amp;-childview=&amp;-index=&#39;,&#39;detailBase&#39;)"">Northshore Riverside Park, Hamilton</a> <br/><b>Venue address</b>:&nbsp;<a href=""http://maps.google.com/?q=-27.444691,153.085008(Northshore+Riverside+Park%2c+Hamilton)"" target=""_blank"">Northshore Riverside Park, 305 Macarthur Avenue, Hamilton</a> <br/><br/>",http://www.brisbane.qld.gov.au/whats-on/events-listed-type/sports-recreation-programs/active-parks-events?trumbaEmbed=view%3devent%26eventid%3d123953940,
"Tai Chi Qigong",http://www.brisbane.qld.gov.au/whats-on/events-listed-type/sports-recreation-programs/active-parks-events?trumbaEmbed=view%3devent%26eventid%3d123953940,,"This dynamic activity is invigorating, works with both your body and your mind and will help you feel relaxed, refreshed and calm. Tai Chi is becoming recognised as the world's most beneficial healthy system. Rejuvenate your body and learn to create a tranquil mind. Join any week - all welcome."
"Games for pre-schoolers","Monday, July 31, 2017, 9&nbsp;&ndash;&nbsp;9:30am <br/><br/><img src=""http://www.trumba.com/i/DgAQXNCAHLpgy0NZaE1V8n4s.jpg"" title=""Games for pre-schoolers"" alt=""Games for pre-schoolers"" width=""132"" height=""79"" /><br/><br/>Traditional games for children to improve their gross motor skills. <br/><br/><b>Cost</b>:&nbsp;Free <br/><b>Event type</b>:&nbsp;Fitness &amp; well-being, Free <br/><b>Bookings</b>:&nbsp;Not required. For more information phone Vanessa at The Extra Mile on 0401 668 434. <br/><b>Meeting point</b>:&nbsp;Next to the playground. <br/><b>Age</b>:&nbsp;2-5 years <br/><b>Venue</b>:&nbsp;<a href=""javascript:Nav(&#39;objectid=221590&amp;objecttype=19243&amp;view=object&amp;-childview=&amp;-index=&#39;,&#39;detailBase&#39;)"">Clivedon Park, Fig Tree Pocket</a> <br/><b>Venue address</b>:&nbsp;<a href=""http://maps.google.com/?q=-27.518214,152.961634(Clivedon+Park%2c+Fig+Tree+Pocket)"" target=""_blank"">Clivedon Park, 62 Terrigal Street, Fig Tree Pocket</a> <br/><br/>",http://www.brisbane.qld.gov.au/whats-on/events-listed-type/sports-recreation-programs/active-parks-events?trumbaEmbed=view%3devent%26eventid%3d123954157,
"Games for pre-schoolers",http://www.brisbane.qld.gov.au/whats-on/events-listed-type/sports-recreation-programs/active-parks-events?trumbaEmbed=view%3devent%26eventid%3d123954157,,"Traditional games for children to improve their gross motor skills."
"High intensity interval training","Monday, July 31, 2017, 9&nbsp;&ndash;&nbsp;10am <br/><br/><img src=""http://www.trumba.com/i/DgAtLSb0CNM40JxbNjnFihGV.jpg"" title=""High intensity interval training"" alt=""High intensity interval training"" width=""132"" height=""79"" /><br/><br/>Bookings essential. A fitness class that alternates between short periods of your maximum effort followed by recovery. This type of training is suitable for beginners and advanced levels and are a great way to burn calories fast. <br/><br/><b>Cost</b>:&nbsp;Free <br/><b>Event type</b>:&nbsp;Fitness &amp; well-being, Free <br/><b>Bookings</b>:&nbsp;Bookings essential. To book phone Jill at FitLiving on 0431 778 513. <br/><b>Meeting point</b>:&nbsp;Near the playground, off Riding Road <br/><b>Venue</b>:&nbsp;<a href=""javascript:Nav(&#39;objectid=221621&amp;objecttype=19243&amp;view=object&amp;-childview=&amp;-index=&#39;,&#39;detailBase&#39;)"">Hawthorne Park, Hawthorne</a> <br/><b>Venue address</b>:&nbsp;<a href=""http://maps.google.com/?q=-27.46368217,153.0620424(Hawthorne+Park%2c+Hawthorne)"" target=""_blank"">Hawthorne Park, 140 Riding Road, Hawthorne</a> <br/><br/>",http://www.brisbane.qld.gov.au/whats-on/events-listed-type/sports-recreation-programs/active-parks-events?trumbaEmbed=view%3devent%26eventid%3d123953950,
"High intensity interval training",http://www.brisbane.qld.gov.au/whats-on/events-listed-type/sports-recreation-programs/active-parks-events?trumbaEmbed=view%3devent%26eventid%3d123953950,,"Bookings essential. A fitness class that alternates between short periods of your maximum effort followed by recovery. This type of training is suitable for beginners and advanced levels and are a great way to burn calories fast."
"Mums and bubs soccer (2-3 years)","Monday, July 31, 2017, 9&nbsp;&ndash;&nbsp;9:30am <br/><br/><img src=""http://www.trumba.com/i/DgAjra0KHcn2%2AxvAJJ2N-bHl.jpg"" title=""Mums and bubs soccer (2-3 years)"" alt=""Mums and bubs soccer (2-3 years)"" width=""132"" height=""79"" /><br/><br/>Bookings essential. Fun, safe, soccer games using balls, goals and cones. This is the perfect mix of fun, physical activity and instruction that is sure to please all. Suitable for 2-3 year olds. <br/><br/><b>Cost</b>:&nbsp;Free <br/><b>Event type</b>:&nbsp;Fitness &amp; well-being, Free <br/><b>Bookings</b>:&nbsp;Bookings essential. To book visit <a href=""http://www.gingersport.com.au/active-parks-program"" target=""_blank"">Ginger Sports</a> or for more information phone 3890 3338. <br/><b>Meeting point</b>:&nbsp;Near the playground <br/><b>Requirements</b>:&nbsp;Closed in shoes <br/><b>Age</b>:&nbsp;2-3 years <br/><b>Venue</b>:&nbsp;<a href=""javascript:Nav(&#39;objectid=221679&amp;objecttype=19243&amp;view=object&amp;-childview=&amp;-index=&#39;,&#39;detailBase&#39;)"">Teralba Park, Everton Park</a> <br/><b>Venue address</b>:&nbsp;<a href=""http://maps.google.com/?q=-27.403471,152.980156(Teralba+Park%2c+Everton+Park)"" target=""_blank"">Teralba Park, 120 Pullen Road, Everton Park</a> <br/><br/>",http://www.brisbane.qld.gov.au/whats-on/events-listed-type/sports-recreation-programs/active-parks-events?trumbaEmbed=view%3devent%26eventid%3d123954045,
"Mums and bubs soccer (2-3 years)",http://www.brisbane.qld.gov.au/whats-on/events-listed-type/sports-recreation-programs/active-parks-events?trumbaEmbed=view%3devent%26eventid%3d123954045,,"Bookings essential. Fun, safe, soccer games using balls, goals and cones. This is the perfect mix of fun, physical activity and instruction that is sure to please all. Suitable for 2-3 year olds."
